title,handle,status,description,subtitle,thumbnail,categories,type_id,collection_id,tags,variant_title,variant_sku,variant_price_amount,variant_price_currency,variant_price_region_id,variant_manage_inventory,variant_inventory_quantity,metadata_seo_title,metadata_seo_description
"Soufflet direction à crémaillère","soufflet-direction-a-cremaillere-066-4104","published","Soufflet direction à crémaillère pour Peugeot 504 et 604. Protège efficacement la crémaillère de direction contre les éléments extérieurs et prolonge sa durée de vie.","Compatible P504,P604","https://encrypted-tbn0.gstatic.com/images?q=tbn:ANd9GcSw417O-XOEr1CoDUbP_hZEFvu-z7RROkcUWScK0j0Nqghu_5oLhhovff9NprM&s","/suspension-direction-cremailleres-direction","","","peugeot,504,604,soufflet,direction,cremaillere","Standard","066.4104","5371","mad","reg_01KCYBHF3PV0D5HHW1NM4RXBQ0","true","100","Soufflet direction Peugeot 504/604 - Pièces Auto","Soufflet de direction crémaillère Peugeot 504 et 604. Protection efficace."
"Soufflet direction à crémaillère","soufflet-direction-a-cremaillere-066-4154","published","Soufflet direction à crémaillère pour Peugeot 104, 205, 106, 109, 504, 309, Citroën ZX, Berlingo et C15. Protection universelle compatible multi-modèles.","Compatible P104/P205/P106/P109/P504/P309/CZX BERLINGO/C15","https://encrypted-tbn0.gstatic.com/images?q=tbn:ANd9GcSWKF_Xsu8ilPPH-0fS0fBlRg5h0VqNBd78ccL0vWHYvMtXPJ-rwDurICIRqEg&s","/suspension-direction-cremailleres-direction","","","peugeot,104,205,106,citroen,zx,berlingo,soufflet","Standard","066.4154","3674","mad","reg_01KCYBHF3PV0D5HHW1NM4RXBQ0","true","100","Soufflet direction Peugeot/Citroën multi-modèles - Pièces Auto","Soufflet direction crémaillère Peugeot et Citroën. Compatible multi-modèles."
"Soufflet direction à crémaillère","soufflet-direction-a-cremaillere-066-4224","published","Soufflet direction à crémaillère pour Citroën Berlingo, C15, Xsara, ZX et Peugeot 306, 309, Partner. Protège la crémaillère contre contamination et usure prématurée.","Compatible CIT BERLINGO/C15/XARA/ZX/P6T/006/306/309/P PARTNER","https://encrypted-tbn0.gstatic.com/images?q=tbn:ANd9GcRRt4AB1ZgLyyVPUMbLdOnKC9StDkqr_gRZAh6MMciWRQJZxOZTadro-csbb2U&s","/suspension-direction-cremailleres-direction","","","citroen,berlingo,c15,xsara,peugeot,306,partner,soufflet","Standard","066.4224","4821","mad","reg_01KCYBHF3PV0D5HHW1NM4RXBQ0","true","100","Soufflet direction Citroën/Peugeot - Pièces Auto","Soufflet direction crémaillère Citroën et Peugeot. Protection contre usure."
"Soufflet direction assistée","soufflet-direction-assistee-066-4284","published","Soufflet direction assistée pour Peugeot 405. Protège le système de direction assistée contre les infiltrations et assure son bon fonctionnement dans le temps.","Compatible P 405","https://encrypted-tbn0.gstatic.com/images?q=tbn:ANd9GcTsmJ0wAlyAzUkW_exCsf2CEMVJJqJndB0uM-f4ns4ysKK2oxsQd_GGMKV4YpU&s","/suspension-direction-cremailleres-direction","","","peugeot,405,soufflet,direction,assistee","Standard","066.4284","8524","mad","reg_01KCYBHF3PV0D5HHW1NM4RXBQ0","true","100","Soufflet direction assistée Peugeot 405 - Pièces Auto","Soufflet de direction assistée Peugeot 405. Protection contre infiltrations."
"Soufflet direction assistée","soufflet-direction-assistee-066-4434","published","Soufflet direction assistée pour Citroën Xsara, ZX, C15, Peugeot 306, Partner, Picasso et Berlingo. Protège efficacement le mécanisme de direction assistée.","Compatible CXSARA/ZX/C15/P 306/P PARTNER/PICASSO BERLINGO","https://encrypted-tbn0.gstatic.com/images?q=tbn:ANd9GcQh95ccm-yQKhyHiBEofKwzDfLY8n0YH0aVrQh9F9UAMQ1BEhZvKKgu-vygow&s","/suspension-direction-cremailleres-direction","","","citroen,xsara,zx,peugeot,306,partner,picasso,soufflet","Standard","066.4434","5721","mad","reg_01KCYBHF3PV0D5HHW1NM4RXBQ0","true","100","Soufflet direction assistée Citroën/Peugeot - Pièces Auto","Soufflet direction assistée Citroën et Peugeot. Protection efficace du mécanisme."
"Biellette barre stabilisatrice","biellette-barre-stabilisatrice-087-5155","published","Biellette barre stabilisatrice pour Peugeot 504 et 505. Relie la barre anti-roulis à la suspension pour améliorer la stabilité en virage et réduire le roulis.","Compatible P504 505","https://encrypted-tbn0.gstatic.com/images?q=tbn:ANd9GcTV1up6GsqyEeY8kAbrEPHXoLgrvTKqvMUJXSJMyRRVnjzuQXnle0EU8emf_A&s","/suspension-direction-biellettes","","","peugeot,504,505,biellette,barre,stabilisatrice","Standard","087.5155","17700","mad","reg_01KCYBHF3PV0D5HHW1NM4RXBQ0","true","100","Biellette barre stabilisatrice Peugeot 504/505 - Pièces Auto","Biellette de barre stabilisatrice Peugeot 504 et 505. Stabilité en virage améliorée."
